{
 "id": "layout_rooftop_gauntlet",
 "name": "Rooftop Gauntlet",
 "base": "rooftop",
 "variant": "night",
 "format": 2,
 "version": 1,
 "author": "Critterweight",
 "description": "Waves pour from the corners; the edges are your friend; the pads fling Blisters off the roof.",
 "example": true,
 "size": [
  14.0,
  12.0
 ],
 "modes": [
  "chum_rush",
  "coop"
 ],
 "flags": {},
 "removed_builtins": [],
 "props": [
  {
   "type": "prop_fire_barrel",
   "pos": [
    -1.6,
    0.0,
    4.7
   ],
   "yaw": 0.0
  },
  {
   "type": "prop_fire_barrel",
   "pos": [
    1.6,
    0.0,
    4.7
   ],
   "yaw": 0.0
  },
  {
   "type": "prop_chum_bucket",
   "pos": [
    -4.6,
    0.0,
    3.6
   ],
   "yaw": 0.0
  },
  {
   "type": "prop_spring_pad",
   "pos": [
    -1.5,
    0.0,
    -4.75
   ],
   "yaw": 0.0
  },
  {
   "type": "prop_spring_pad",
   "pos": [
    3.4,
    0.0,
    4.55
   ],
   "yaw": 0.0
  },
  {
   "type": "prop_heavy_crate",
   "pos": [
    2.4,
    0.0,
    -4.4
   ],
   "yaw": 0.0
  }
 ],
 "markers": {
  "spawn": [
   {
    "pos": [
     0.0,
     0.0,
     -2.9
    ],
    "yaw": -0.0,
    "team": -1
   },
   {
    "pos": [
     2.69,
     0.0,
     -2.05
    ],
    "yaw": -52.7,
    "team": -1
   },
   {
    "pos": [
     3.8,
     0.0,
     0.0
    ],
    "yaw": -90.0,
    "team": -1
   },
   {
    "pos": [
     2.69,
     0.0,
     2.05
    ],
    "yaw": -127.3,
    "team": -1
   },
   {
    "pos": [
     0.0,
     0.0,
     2.9
    ],
    "yaw": -180.0,
    "team": -1
   },
   {
    "pos": [
     -2.69,
     0.0,
     2.05
    ],
    "yaw": 127.3,
    "team": -1
   },
   {
    "pos": [
     -3.8,
     0.0,
     0.0
    ],
    "yaw": 90.0,
    "team": -1
   },
   {
    "pos": [
     -2.69,
     0.0,
     -2.05
    ],
    "yaw": 52.7,
    "team": -1
   },
   {
    "pos": [
     -4.2,
     0.0,
     -0.9
    ],
    "yaw": 90.0,
    "team": 0
   },
   {
    "pos": [
     -4.2,
     0.0,
     0.9
    ],
    "yaw": 90.0,
    "team": 0
   },
   {
    "pos": [
     -3.0,
     0.0,
     -1.9
    ],
    "yaw": 90.0,
    "team": 0
   },
   {
    "pos": [
     -3.0,
     0.0,
     1.9
    ],
    "yaw": 90.0,
    "team": 0
   },
   {
    "pos": [
     4.2,
     0.0,
     -0.9
    ],
    "yaw": -90.0,
    "team": 1
   },
   {
    "pos": [
     4.2,
     0.0,
     0.9
    ],
    "yaw": -90.0,
    "team": 1
   },
   {
    "pos": [
     3.0,
     0.0,
     -1.9
    ],
    "yaw": -90.0,
    "team": 1
   },
   {
    "pos": [
     3.0,
     0.0,
     1.9
    ],
    "yaw": -90.0,
    "team": 1
   }
  ],
  "wave_gate": [
   {
    "pos": [
     -6.2,
     0.0,
     5.2
    ],
    "yaw": 135.0,
    "team": -1,
    "size": [
     2.0,
     2.4,
     0.2
    ]
   },
   {
    "pos": [
     6.2,
     0.0,
     -5.2
    ],
    "yaw": -45.0,
    "team": -1,
    "size": [
     2.0,
     2.4,
     0.2
    ]
   },
   {
    "pos": [
     4.2,
     0.0,
     3.2
    ],
    "yaw": -135.0,
    "team": -1,
    "size": [
     2.0,
     2.4,
     0.2
    ]
   },
   {
    "pos": [
     -4.2,
     0.0,
     -3.2
    ],
    "yaw": 45.0,
    "team": -1,
    "size": [
     2.0,
     2.4,
     0.2
    ]
   }
  ],
  "respawn": [
   {
    "pos": [
     -4.6,
     0.0,
     -1.2
    ],
    "yaw": 90.0,
    "team": -1
   },
   {
    "pos": [
     4.6,
     0.0,
     1.2
    ],
    "yaw": -90.0,
    "team": -1
   },
   {
    "pos": [
     -1.2,
     0.0,
     3.7
    ],
    "yaw": 180.0,
    "team": -1
   },
   {
    "pos": [
     1.2,
     0.0,
     -3.7
    ],
    "yaw": 0.0,
    "team": -1
   },
   {
    "pos": [
     -4.4,
     0.0,
     2.6
    ],
    "yaw": 135.0,
    "team": -1
   },
   {
    "pos": [
     4.4,
     0.0,
     -2.6
    ],
    "yaw": -45.0,
    "team": -1
   },
   {
    "pos": [
     2.8,
     0.0,
     3.2
    ],
    "yaw": -150.0,
    "team": -1
   },
   {
    "pos": [
     -2.8,
     0.0,
     -3.2
    ],
    "yaw": 30.0,
    "team": -1
   }
  ]
 }
}
