{
 "id": "arena_rooftop",
 "name": "The Rooftop",
 "base": "rooftop",
 "variant": "night",
 "format": 2,
 "version": 1,
 "author": "Critterweight",
 "description": "The cannery roof at night: no cage, open edges on every side. Ring-outs cost 8% HP and 2.5 s; wind gusts shove everyone 1.5 m every 18 s. Railings guard the short sides until someone is splatted through them.",
 "size": [
  14.0,
  12.0
 ],
 "modes": [
  "duel",
  "ffa",
  "teams",
  "coop",
  "absolute_unit",
  "chum_rush",
  "boss"
 ],
 "flags": {},
 "removed_builtins": [],
 "props": [],
 "markers": {
  "spawn": [
   {
    "pos": [
     0.0,
     0.0,
     -2.9
    ],
    "yaw": -0.0,
    "team": -1
   },
   {
    "pos": [
     2.69,
     0.0,
     -2.05
    ],
    "yaw": -52.7,
    "team": -1
   },
   {
    "pos": [
     3.8,
     0.0,
     0.0
    ],
    "yaw": -90.0,
    "team": -1
   },
   {
    "pos": [
     2.69,
     0.0,
     2.05
    ],
    "yaw": -127.3,
    "team": -1
   },
   {
    "pos": [
     0.0,
     0.0,
     2.9
    ],
    "yaw": -180.0,
    "team": -1
   },
   {
    "pos": [
     -2.69,
     0.0,
     2.05
    ],
    "yaw": 127.3,
    "team": -1
   },
   {
    "pos": [
     -3.8,
     0.0,
     0.0
    ],
    "yaw": 90.0,
    "team": -1
   },
   {
    "pos": [
     -2.69,
     0.0,
     -2.05
    ],
    "yaw": 52.7,
    "team": -1
   },
   {
    "pos": [
     -4.2,
     0.0,
     -0.9
    ],
    "yaw": 90.0,
    "team": 0
   },
   {
    "pos": [
     -4.2,
     0.0,
     0.9
    ],
    "yaw": 90.0,
    "team": 0
   },
   {
    "pos": [
     -3.0,
     0.0,
     -1.9
    ],
    "yaw": 90.0,
    "team": 0
   },
   {
    "pos": [
     -3.0,
     0.0,
     1.9
    ],
    "yaw": 90.0,
    "team": 0
   },
   {
    "pos": [
     4.2,
     0.0,
     -0.9
    ],
    "yaw": -90.0,
    "team": 1
   },
   {
    "pos": [
     4.2,
     0.0,
     0.9
    ],
    "yaw": -90.0,
    "team": 1
   },
   {
    "pos": [
     3.0,
     0.0,
     -1.9
    ],
    "yaw": -90.0,
    "team": 1
   },
   {
    "pos": [
     3.0,
     0.0,
     1.9
    ],
    "yaw": -90.0,
    "team": 1
   }
  ],
  "boss": [
   {
    "pos": [
     0,
     0.0,
     2.2
    ],
    "yaw": 180.0,
    "team": -1
   }
  ],
  "unit_spawn": [
   {
    "pos": [
     0,
     0.0,
     -1.6
    ],
    "yaw": 0.0,
    "team": -1
   }
  ],
  "wave_gate": [
   {
    "pos": [
     -6.2,
     0.0,
     5.2
    ],
    "yaw": 135.0,
    "team": -1,
    "size": [
     2.0,
     2.4,
     0.2
    ]
   },
   {
    "pos": [
     6.2,
     0.0,
     -5.2
    ],
    "yaw": -45.0,
    "team": -1,
    "size": [
     2.0,
     2.4,
     0.2
    ]
   },
   {
    "pos": [
     4.2,
     0.0,
     3.2
    ],
    "yaw": -135.0,
    "team": -1,
    "size": [
     2.0,
     2.4,
     0.2
    ]
   },
   {
    "pos": [
     -4.2,
     0.0,
     -3.2
    ],
    "yaw": 45.0,
    "team": -1,
    "size": [
     2.0,
     2.4,
     0.2
    ]
   }
  ],
  "respawn": [
   {
    "pos": [
     -4.6,
     0.0,
     -1.2
    ],
    "yaw": 90.0,
    "team": -1
   },
   {
    "pos": [
     4.6,
     0.0,
     1.2
    ],
    "yaw": -90.0,
    "team": -1
   },
   {
    "pos": [
     -1.2,
     0.0,
     3.7
    ],
    "yaw": 180.0,
    "team": -1
   },
   {
    "pos": [
     1.2,
     0.0,
     -3.7
    ],
    "yaw": 0.0,
    "team": -1
   },
   {
    "pos": [
     -4.4,
     0.0,
     2.6
    ],
    "yaw": 135.0,
    "team": -1
   },
   {
    "pos": [
     4.4,
     0.0,
     -2.6
    ],
    "yaw": -45.0,
    "team": -1
   },
   {
    "pos": [
     2.8,
     0.0,
     3.2
    ],
    "yaw": -150.0,
    "team": -1
   },
   {
    "pos": [
     -2.8,
     0.0,
     -3.2
    ],
    "yaw": 30.0,
    "team": -1
   }
  ]
 },
 "base_def": {
  "id": "rooftop",
  "name": "The Rooftop",
  "shape": "notched_rect",
  "style": "rooftop",
  "description": "The cannery roof at night: no cage, open edges on every side. Ring-outs cost 8% HP and 2.5 s; wind gusts shove everyone 1.5 m every 18 s. Railings guard the short sides until someone is splatted through them.",
  "size": [
   14.0,
   12.0
  ],
  "size_min": [
   10.0,
   9.0
  ],
  "size_max": [
   14.0,
   12.0
  ],
  "size_step": 0.5,
  "notch": [
   2.0,
   2.0
  ],
  "wall_height": 0.0,
  "open_edges": true,
  "allow_pits": true,
  "quirks": {},
  "ringout": {
   "damage_frac": 0.08,
   "out_time": 2.5,
   "invuln": 1.0,
   "fall_y": -1.2
  },
  "hazards": [
   {
    "id": "wind",
    "type": "wind_gust",
    "period": 18.0,
    "first": 18.0,
    "telegraph": 1.5,
    "active": 1.0,
    "push": 1.5,
    "gale_resist": 0.5,
    "flag": "wind_gusts",
    "label": "Wind gusts"
   }
  ],
  "areas": [],
  "builtins": [
   {
    "id": "hvac_w",
    "type": "prop_hvac_unit",
    "pos": [
     -1.2,
     0.0,
     0.0
    ],
    "yaw": 0.0
   },
   {
    "id": "hvac_e",
    "type": "prop_hvac_unit",
    "pos": [
     1.2,
     0.0,
     0.0
    ],
    "yaw": 0.0
   },
   {
    "id": "hvac_s",
    "type": "prop_hvac_unit",
    "pos": [
     5.6,
     0.0,
     -4.9
    ],
    "yaw": 0.0
   },
   {
    "id": "tower_leg",
    "type": "prop_water_tower_leg",
    "pos": [
     -5.6,
     0.0,
     4.6
    ],
    "yaw": 0.0
   },
   {
    "id": "railing_e",
    "type": "prop_edge_railing",
    "pos": [
     6.95,
     0.0,
     -1.0
    ],
    "yaw": 90.0,
    "anchor": "e",
    "span": true,
    "inset": 0.06
   },
   {
    "id": "railing_w",
    "type": "prop_edge_railing",
    "pos": [
     -6.95,
     0.0,
     1.0
    ],
    "yaw": 90.0,
    "anchor": "w",
    "span": true,
    "inset": 0.06
   }
  ],
  "variants": {
   "night": {
    "label": "Night",
    "key": "#B9C6FF",
    "key_energy": 0.8,
    "rim": "#E04FB0",
    "rim2": "#8BD426",
    "spot": "#E9EEFF",
    "bg": "#101624",
    "fog": "#141B30",
    "fog_density": 0.006,
    "ambient": "#2A3150",
    "ambient_energy": 0.7,
    "crowd_energy": 0.3
   },
   "night_neon": {
    "label": "Night (full neon)",
    "hidden": true,
    "unlock": "hub_rooftop_neon",
    "replaces": "night",
    "sign_full": true,
    "key": "#C9D2FF",
    "key_energy": 0.85,
    "rim": "#FF5FC4",
    "rim2": "#9BEA2E",
    "spot": "#F2F4FF",
    "bg": "#120F24",
    "fog": "#1C1636",
    "fog_density": 0.006,
    "ambient": "#33305A",
    "ambient_energy": 0.78,
    "crowd_energy": 0.4
   }
  },
  "default_variant": "night",
  "palette": {
   "floor": "#2F2B2B",
   "gravel": "#6E6A66",
   "neon_a": "#8BD426",
   "neon_b": "#E04FB0",
   "sky": "#101624"
  }
 }
}
